<!ENTITY % datosPersona "(nombre, apellidos, email)">
<!ELEMENT fabrica (pabellon+)>
<!ELEMENT pabellon (nombre, responsable, trabajadores)>
<!ATTLIST pabellon
        id ID #REQUIRED
        numEmpleados CDATA #IMPLIED>
<!ELEMENT nombre (#PCDATA)>
<!ELEMENT responsable %datosPersona;>
<!ELEMENT trabajadores (trabajador+)>
<!ELEMENT trabajador %datosPersona;>
<!ATTLIST trabajador
        dni ID #REQUIRED
        extension CDATA #IMPLIED>
<!ELEMENT apellidos (#PCDATA)>
<!ELEMENT email (#PCDATA)>